,stock,date,time,heading,compound score
0,TSLA,2021-03-15,11:36PM  ,China Signal Users Report Difficulty Accessing Messaging App,-0.34
1,TSLA,2021-03-15,11:17PM  ,Bitcoin Losses Accelerate After Weekend Rally to Record High,-0.4019
2,TSLA,2021-03-15,11:04PM  ,NTSB sends team to Detroit to investigate violent Tesla crash,-0.765
3,TSLA,2021-03-15,11:01PM  ,Dow Jones Futures Fall As Bitcoin Tumbles From Record Highs; This EV Leader Surges Again,0.0
4,TSLA,2021-03-15,08:54PM  ,UPDATE 2-U.S. safety agency probes 'violent' Tesla crash in Detroit,0.0258
5,TSLA,2021-03-15,06:46PM  ,U.S. safety agency probes 'violent' Tesla crash in Detroit,0.0258
6,TSLA,2021-03-15,05:56PM  ,"Elon Musk's Tweet About Selling NFTs Song As NFT Gets $100,000 Bid",0.0
7,TSLA,2021-03-15,05:08PM  ,"Tesla Model 3 Surpasses VW ID.3 In Germany, Becomes Country's No. 2 EV Bestseller In February",-0.296
8,TSLA,2021-03-15,05:04PM  ,Major Tech Supplier Stops Selling Verkada Cameras After Hack,-0.1531
9,TSLA,2021-03-15,04:28PM  ,Elon Musk Is Now the Technoking of Tesla. Whats Behind the Name.,0.0
10,TSLA,2021-03-15,04:21PM  ,US STOCKS-S&P 500 and Dow end session at record highs,0.0
11,TSLA,2021-03-15,04:04PM  ,Volkswagen Lays Out Ambitious EV Battery Plans After Partner's Big Breakthrough,0.4767
12,TSLA,2021-03-15,04:00PM  ,US STOCKS-S&P 500 ends at record high as Wall Street rises,0.0
13,TSLA,2021-03-15,03:25PM  ,The Tesla bubble: Bets on electric cars and the rise of SPACs have led to a new version of the dot-com boom,0.0
14,TSLA,2021-03-15,03:11PM  ,Tesla Semi Prototype Hits The Test Track: Watch The Official Video,0.0
15,TSLA,2021-03-15,03:02PM  ,"In One Chart: The explosion in electric-vehicle funding, valuation and trading",0.0
16,TSLA,2021-03-15,02:55PM  ,"Billions poured into electric-vehicle companies, but much more will be needed before the auto industry changes",0.0
17,TSLA,2021-03-15,02:38PM  ,US STOCKS-Dow hits record high as Wall Street rises,0.0
18,TSLA,2021-03-15,02:36PM  ,"Dow Jones Rises, Nasdaq Leads; Airlines Soar; Germany, France Suspend Covid Vaccine",-0.3182
19,TSLA,2021-03-15,01:55PM  ,Tesla faces race with Volkswagen as German car giant targets battery costs and new gigafactories,0.0
20,TSLA,2021-03-15,01:05PM  ,Bitcoin Falls After Weekend Rally Pushes Token to Fresh Record,0.3182
21,TSLA,2021-03-15,12:47PM  ,"What Musk's 'Technoking' Title, Tesla's New Truck Exec Mean For Automaker's Tech, Bitcoin, Semi Plans",0.0
22,TSLA,2021-03-15,12:40PM  ,UPDATE 1-Tesla names Musk 'Technoking' in cryptic regulatory filing,0.0
23,TSLA,2021-03-15,12:26PM  ,Volkswagen Takes on Tesla With Battery Push,0.0
24,TSLA,2021-03-15,12:14PM  ,US STOCKS-Wall Street slips on jitters before Fed meeting,0.0
25,TSLA,2021-03-15,11:33AM  ,"Airlines soar, AMC jumps, Musks new title",0.0
26,TSLA,2021-03-15,11:08AM  ,Elon Musk names himself TechnoKing of Tesla,0.0
27,TSLA,2021-03-15,10:23AM  ,US STOCKS-S&P 500 subdued as focus turns to Fed,0.0
28,TSLA,2021-03-15,10:16AM  ,Musk Adds Technoking of Tesla Title; CFO Is Coin Master,0.0
29,TSLA,2021-03-15,10:15AM  ,Holley CEO talks going public via SPAC amid pandemic,0.0
30,TSLA,2021-03-15,10:12AM  ,"Dow Reverses From All-Time High As Bitcoin Falls From New High; Apple, Tesla Rally",0.0
31,TSLA,2021-03-15,10:00AM  ,"Stocks open higher, Elon Musk now officially Technoking of Tesla",0.0
32,TSLA,2021-03-15,10:00AM  ,"Elon Musk Named ""Technoking"" of Tesla",0.0
33,TSLA,2021-03-15,09:51AM  ,Elon Musk is now officially Technoking of Tesla,0.0
34,TSLA,2021-03-15,09:07AM  ,US STOCKS-Wall Street set for muted open after strong comeback,0.5106
35,TSLA,2021-03-15,08:51AM  ,"Elon Musk adds 'Technoking of Tesla' title, CFO takes 'Master of Coin' title: filing",0.0
36,TSLA,2021-03-15,08:15AM  ,"Elon Musk Anointed 'Technoking of Tesla,' CFO Zach Kirkhorn Named 'Master Of Coin'",0.0
37,TSLA,2021-03-15,08:01AM  ,"Dow Jones Futures: Market Rally Expands, Bitcoin Falls On Crypto Ban Fears; NXP Semi Leads Four Stocks Set To Jump",-0.7184
38,TSLA,2021-03-15,07:27AM  ,Tesla names Musk 'Technoking' in cryptic regulatory filing,0.0
39,TSLA,2021-03-15,07:23AM  ,Tesla names Musk 'Technoking' in cryptic regulatory filing,0.0
40,TSLA,2021-03-15,05:40AM  ,Tesla Prepares For Shanghai Gigafactory Expansion,0.0
41,TSLA,2021-03-15,03:46AM  ,Tesla Revokes FSD Beta Access For Driver Who Don't Pay 'Sufficient Attention To The Road',0.0762
42,TSLA,2021-03-15,03:17AM  ,"Yellen on Inflation, Astra Pushes Back, and TechnoKing Musk;  What's up in Markets",0.0
43,TSLA,2021-03-15,03:15AM  ,Elon Musk Officially Is Now the 'Technoking' of Tesla,0.0
44,TSLA,2021-03-15,01:26AM  ,Tesla Fremont Factory Recorded 450 COVID-19 Cases After Controversial Reopening In May: Report,-0.2023
45,TSLA,2021-03-14,10:36PM  ,Elon Musk's Weekend Dogemania: Calls On Coinbase To Support Dogecoin And Sends Wrong Crypto Soaring Again,-0.1027
46,TSLA,2021-03-14,08:00PM  ,Musk to become technoking of Tesla,0.0
47,TSLA,2021-03-14,08:00PM  ,Elon Musk now identifies as Technoking of Tesla,0.0
48,TSLA,2021-03-14,05:21PM  ,Tesla factory had more than 400 COVID-19 cases after Elon Musks defiant reopening: report,-0.2263
49,TSLA,2021-03-14,01:00PM  ,GM Is Betting Big On Electric Vehicles,0.0
50,TSLA,2021-03-14,08:10AM  ,Is GM Stock A Buy? General Motors Makes Bullish Move As Tesla Struggles,-0.3612
51,TSLA,2021-03-14,07:07AM  ,What Apple Investors Should Be Watching,0.0
52,TSLA,2021-03-14,06:45AM  ,These 3 Tech Stocks Are Building the Future,0.0
53,TSLA,2021-03-14,04:00AM  ,Outgoing CEO says Panasonic must cut Tesla reliance as battery tie-up evolves: FT,0.0258
54,TSLA,2021-03-14,03:48AM  ,Outgoing CEO says Panasonic must cut Tesla reliance as battery tie-up evolves - Financial Times,0.0258
55,TSLA,2021-03-14,03:42AM  ,Outgoing CEO says Panasonic must cut Tesla reliance as battery tie-up evolves -FT,0.0258
56,TSLA,2021-03-14,01:49AM  ,Economic Calendar - Top 5 Things to Watch This Week,0.2023
57,TSLA,2021-03-13,07:01PM  ,The King of Nickel Is Betting Big on a Green Future in Batteries,0.0
58,TSLA,2021-03-13,07:00PM  ,Panasonic to reduce Tesla reliance as battery tie-up evolves,0.0
59,TSLA,2021-03-13,02:49PM  ,US Transportation Regulator Singles Out Tesla In Calling For Tighter Autonomous Driving Rules,0.0
60,TSLA,2021-03-13,12:00PM  ,3 Major Technology Advantages That Lucid Motors Has Over Tesla,0.3612
61,TSLA,2021-03-13,10:19AM  ,"Investor Sues Elon Musk, Tesla Board Over 'Erratic' Tweeting, Alleging Violation Of SEC Settlement",-0.4939
62,TSLA,2021-03-13,10:00AM  ,"Benzinga's Bulls And Bears Of The Week: Apple, Lemonade, Sundial, Tesla And More",0.0
63,TSLA,2021-03-13,08:00AM  ,Tesla Accepts Payment in Bitcoin: Should Landlords Do the Same?,0.3182
64,TSLA,2021-03-13,07:00AM  ,"One Bank Made Big Bets on Apple, Tesla, Nio, and Other EV Stocks",0.0
65,TSLA,2021-03-12,05:45PM  ,Tesla (TSLA) Stock Sinks As Market Gains: What You Should Know,0.34
66,TSLA,2021-03-12,04:25PM  ,Tesla Expanding Insurance On Its Cars To Illinois,0.0
67,TSLA,2021-03-12,04:14PM  ,NTSB Slams Tesla Autopilot in Push for Stricter Autonomous Driving Standards,0.0
68,TSLA,2021-03-12,04:09PM  ,Short Seller Adds Another EV Stock To Its Hit List,0.0
69,TSLA,2021-03-12,04:00PM  ,"Americas Top 1,200 Financial Advisors",0.2023
70,TSLA,2021-03-12,02:02PM  ,Tesla: Breaking Down Mizuhos New Bullish Call,0.0
71,TSLA,2021-03-12,01:55PM  ,"UPDATE 1-Tesla investor sues Musk, claims tweets violate SEC settlement",-0.4939
72,TSLA,2021-03-12,01:45PM  ,Nasdaq Slips As Biden Stimulus Raises These Fears; Dow Rallies; Warren Buffett Stock Crumbles,-0.4215
73,TSLA,2021-03-12,01:06PM  ,"Tesla investor sues Musk, claims tweets violate SEC settlement",-0.4939
74,TSLA,2021-03-12,11:17AM  ,"Swiss Police Raid Apartment of Verkada Hacker, Seize Devices",0.0
75,TSLA,2021-03-12,11:13AM  ,Electric-Vehicle Stocks Dash Rebound Hopes as Bad News Piles Up,-0.1779
76,TSLA,2021-03-12,11:06AM  ,Stocks mixed after record-setting rally,0.0
77,TSLA,2021-03-12,10:17AM  ,Tesla Shares Drop After Fire at EV Makers California Plant,-0.3182
78,TSLA,2021-03-12,10:14AM  ,Lordstown Motors shorted by Hindenburg research,0.0
79,TSLA,2021-03-12,10:09AM  ,Tesla In Talks With Tata Power For India Charging Infrastructure,0.0
80,TSLA,2021-03-12,09:37AM  ,It's Not Too Late to Buy the Bounce: These 3 Unstoppable Stocks Are Still 20% Off Their Highs,-0.2023
81,TSLA,2021-03-12,07:45AM  ,"Is Tesla Stock A Buy After A Giant Run And Transformative, Robust Year?",0.34
82,TSLA,2021-03-12,07:05AM  ,Why Is Everyone Talking About Electric Vehicle Stocks?,0.0
83,TSLA,2021-03-12,07:00AM  ,"Top-Notch Mutual Fund Loves Facebook, Other FAANG Stocks, Taiwan Semiconductor",0.5719
84,TSLA,2021-03-12,06:27AM  ,"XPeng stock falls even as losses narrow and revenue rises, amid broader weakness in EV stocks",-0.6705
85,TSLA,2021-03-12,06:04AM  ,2 Stocks Cathie Wood Loves That Should Be Bigger Winners Than Tesla,0.7783
86,TSLA,2021-03-12,05:48AM  ,UPDATE 2-Tesla in talks with India's Tata Power for EV charging infrastructure -report,0.0
87,TSLA,2021-03-12,05:31AM  ,Tesla in talks with India's Tata Power for EV charging infrastructure -report,0.0
88,TSLA,2021-03-12,05:20AM  ,Tesla in talks with Tata Power for EV charging infrastructure -report,0.0
89,TSLA,2021-03-12,02:53AM  ,"Tesla Fremont Factory Suffers Fire Damage, No Injuries Reported",-0.872
90,TSLA,2021-03-12,12:23AM  ,Tesla Delays Model S Plaid Plus Deliveries To Middle Of Next Year,0.0
91,TSLA,2021-03-11,10:58PM  ,Teslas Giga Press catches fire at California factory,-0.34
92,TSLA,2021-03-11,09:54PM  ,"Tesla Changes Vehicle Prices by as Much as $10,000 in Web Update",0.0
93,TSLA,2021-03-11,09:01PM  ,"Fire at Tesla's Fremont factory under control, no injuries reported",-0.5574
94,TSLA,2021-03-11,08:41PM  ,"Fire at Tesla's Fremont factory under control, no injuries reported",-0.5574
95,TSLA,2021-03-11,08:00PM  ,Can Fuel Cell Cars Compete With The EV Boom?,0.0
96,TSLA,2021-03-11,04:35PM  ,Stock Market Today: S&P 500 Sets New High as Biden Blesses Stimulus,0.5574
97,TSLA,2021-03-11,04:03PM  ,"EV Startup That Drew Apple Interest Takes On Tesla, GM In Hot Pickup Market",0.4588
98,TSLA,2021-03-11,03:53PM  ,Video Shows Tesla Model 3 Accelerating Away From Attempted Carjacking,0.0
99,TSLA,2021-03-11,03:07PM  ,"Tesla, Nio stocks surge after Mizuho analyst said buy the EV leaders",0.0
