,stock,date,time,heading,compound score
0,FRC,2021-03-18,09:51AM  ,First Republic Bank (FRC) Ratings and Outlook Affirmed by Moody's,0.0
1,FRC,2021-03-18,03:49AM  ,Is First Republic Bank's (NYSE:FRC) 154% Share Price Increase Well Justified?,0.8074
2,FRC,2021-03-17,06:44PM  ,"First Republic Bank -- Moody's affirms First Republic's ratings (Baa1 stable), outlook remains stable",0.296
3,FRC,2021-03-17,06:12PM  ,"First Republic Bank -- Moody's affirms First Republic's ratings (Baa1 stable), outlook remains stable",0.296
4,FRC,2021-03-15,09:00AM  ,Wealth Management Team Led by Andrew Vahab Joins First Republic,0.4939
5,FRC,2021-03-12,08:21AM  ,5 Reasons to Buy First Republic Bank (FRC) Stock Right Now,0.0
6,FRC,2021-03-02,09:23AM  ,"First Republic Bank's (FRC) Shares March Higher, Can It Continue?",0.296
7,FRC,2021-03-02,08:45AM  ,First Republic Bank Prices Common Stock Offering,0.0
8,FRC,2021-03-01,04:06PM  ,First Republic Bank Announces Common Stock Offering,0.0
9,FRC,2021-03-01,09:00AM  ,First Republic Bank Declares Dividends on Two Series of Perpetual Preferred Stock for First Quarter 2021,0.0
10,FRC,2021-02-23,05:27PM  ,"These Stocks Show Strength In IBD Stock Screener, Pass Buy Points Amid Market Turbulence",0.4939
11,FRC,2021-02-19,07:25PM  ,J.P. Morgan Mortgage Trust 2021-3 -- Moody's assigns provisional ratings to Prime RMBS issued by J.P. Morgan Mortgage Trust 2021-3,0.765
12,FRC,2021-02-19,07:10PM  ,Moody's assigns provisional ratings to Prime RMBS issued by J.P. Morgan Mortgage Trust 2021-3,0.5106
13,FRC,2021-02-17,09:13AM  ,Regional Bank ETFs Set Multi-Year High as Bond Yields Surge,0.0
14,FRC,2021-02-16,09:00AM  ,First Republic Bank to Present at the Raymond James Institutional Investors Conference,0.0
15,FRC,2021-02-13,11:30AM  ,Why Is First Republic Bank (FRC) Down 1.7% Since Last Earnings Report?,0.0
16,FRC,2021-02-08,12:22PM  ,Banks Are Taking Advantage of Low Rates to Issue Preferred Shares,0.2732
17,FRC,2021-02-08,09:00AM  ,Wealth Management Team Led by Michael Kramer Joins First Republic,0.4939
18,FRC,2021-02-08,08:30AM  ,First Republic Bank Issues Notice of Redemption of Series G Preferred Shares,0.296
19,FRC,2021-02-05,10:25AM  ,First Republic Bank -- Moody's announces completion of a periodic review of ratings of First Republic Bank,0.0
20,FRC,2021-02-01,11:30AM  ,First Republic (FRC) Gave Ensemble Capital Hefty Gains,0.34
21,FRC,2021-01-28,05:05PM  ,First Republic Bank Announces Pricing of $650 Million Series L Preferred Stock Offering,0.0
22,FRC,2021-01-28,08:42AM  ,First Republic Announces Series L Preferred Stock Offering,0.0
23,FRC,2021-01-27,11:05AM  ,Traders Look to Regional Banks for Growth,0.3818
24,FRC,2021-01-26,10:16AM  ,Understanding First Republic Bank's Ex-Dividend Date,0.0
25,FRC,2021-01-20,12:34PM  ,Weitz Partners: First Republic is a Powerful Unit Growth,0.6597
26,FRC,2021-01-14,02:43PM  ,A Look Into First Republic Bank's Price Over Earnings,0.0
27,FRC,2021-01-14,09:57AM  ,First Republic (FRC) Q4 Earnings Beat on Higher Revenues,0.0
28,FRC,2021-01-14,08:35AM  ,First Republic Bank (FRC) Q4 Earnings and Revenues Top Estimates,0.2023
29,FRC,2021-01-14,08:00AM  ,"First Republic Bank (San Francisco, California) to Host Earnings Call",0.0
30,FRC,2021-01-14,07:16AM  ,First Republic Bank: Q4 Earnings Insights,0.0
31,FRC,2021-01-14,07:00AM  ,First Republic Reports 2020 Results,0.0
32,FRC,2021-01-13,10:16AM  ,Earnings Outlook for First Republic Bank,0.0
33,FRC,2021-01-13,08:50AM  ,Should You Buy First Republic (FRC) Ahead of Earnings?,0.0
34,FRC,2021-01-13,08:49AM  ,Fee Income Growth to Aid First Republic (FRC) Q4 Earnings,0.3818
35,FRC,2021-01-12,08:59AM  ,Is First Republic Bank (FRC) Stock a Buy For 2021?,0.0
36,FRC,2021-01-10,12:30PM  ,"Big banks kick off Q4 earnings season, retail sales: What to know in the week ahead",0.0
37,FRC,2021-01-07,12:30PM  ,First Republic Bank (FRC) Reports Next Week: Wall Street Expects Earnings Growth,0.3818
38,FRC,2021-01-05,09:00AM  ,First Republic Bank Declares Dividends on Series J and K Perpetual Preferred Stock,0.0
39,FRC,2020-12-29,09:00AM  ,First Republic Bank Announces Fourth Quarter and Full Year 2020 Earnings and Conference Call Date,0.0
40,FRC,2020-12-20,07:03PM  ,Is FRC A Good Stock To Buy Now?,0.4404
41,FRC,2020-12-18,01:35AM  ,How Much Did First Republic Bank's (NYSE:FRC) CEO Pocket Last Year?,0.0
42,FRC,2020-12-16,06:30AM  ,16 Bank Stocks That Could Outpace the Sector in 2021,0.0
43,FRC,2020-12-04,05:11PM  ,First Republic Bank -- Moody's affirms First Republic Bank's assessment as a Strong originator of prime jumbo residential mortgage loans,0.5106
44,FRC,2020-12-01,09:00AM  ,First Republic Bank Declares Dividends on Three Series of Perpetual Preferred Stock for Fourth Quarter 2020,0.0
45,FRC,2020-11-30,09:00AM  ,First Republic Bank to Present at the Goldman Sachs US Financial Services Conference,0.0
46,FRC,2020-11-20,05:21PM  ,Weeks Best: Fidelitys Big Launch,0.6369
47,FRC,2020-11-16,12:48PM  ,"David Rolfe Buys First Republic Bank, Trims Several Top Holdings",0.2023
48,FRC,2020-11-16,09:00AM  ,Wealth Management Team Led by John McNamee and Daniel White Joins First Republic,0.4939
49,FRC,2020-11-13,02:04PM  ,"Wallace Weitz Buys Fidelity National, First Republic Bank in 3rd Quarter",0.0
50,FRC,2020-11-12,11:30AM  ,Why Is First Republic Bank (FRC) Up 11.4% Since Last Earnings Report?,0.0
51,FRC,2020-11-12,08:30AM  ,First Republic Bank Prices Common Stock Offering,0.0
52,FRC,2020-11-11,04:09PM  ,First Republic Bank Announces Common Stock Offering,0.0
53,FRC,2020-11-06,08:27AM  ,Preferred-Stock Yields Are Dropping. Banks Are Taking Advantage.,0.25
54,FRC,2020-11-03,04:01PM  ,Were These Hedge Funds Right About Betting On First Republic Bank (FRC)?,0.0
55,FRC,2020-10-27,09:00AM  ,First Republic Bank to Present at Upcoming November Investor Conferences,0.0
56,FRC,2020-10-26,09:00AM  ,First Republic Founders IndexSM Outperformed the S&P 500 by 46% in Its First Year,0.0
57,FRC,2020-10-25,08:13AM  ,"At More Than Double Book Value, Can First Republic Bank's Stock Keep Climbing?",0.34
58,FRC,2020-10-21,12:00PM  ,First Republic Bank (FRC) Is Up 2.47% in One Week: What You Should Know,0.0
59,FRC,2020-10-20,10:54AM  ,Is First Republic Bank (FRC) a Smart Long-term Buy?,0.4019
60,FRC,2020-10-19,09:25AM  ,Is Now The Time To Put First Republic Bank (NYSE:FRC) On Your Watchlist?,0.0
61,FRC,2020-10-16,05:20PM  ,Sequoia Mortgage Trust 2017-6 -- Moody's takes action on 12 Prime Jumbo RMBS issued by Sequoia Mortgage Trust,0.765
62,FRC,2020-10-13,07:01PM  ,First Republic Bank (FRC) Q3 2020 Earnings Call Transcript,0.0
63,FRC,2020-10-13,09:53AM  ,P/E Ratio Insights for First Republic Bank,0.0
64,FRC,2020-10-13,08:15AM  ,First Republic Bank (FRC) Q3 Earnings and Revenues Surpass Estimates,0.0
65,FRC,2020-10-13,08:00AM  ,"First Republic Bank (San Francisco, California) to Host Earnings Call",0.0
66,FRC,2020-10-13,07:22AM  ,First Republic Bank: Q3 Earnings Insights,0.0
67,FRC,2020-10-13,07:00AM  ,First Republic Reports Third Quarter 2020 Results,0.0
68,FRC,2020-10-12,12:03PM  ,Why First Republic Bank (FRC) Stock is a Compelling Investment Case,0.2263
69,FRC,2020-10-12,10:42AM  ,First Republic Bank's Earnings: A Preview,0.0
70,FRC,2020-10-09,07:28PM  ,"After Years of Anticipation, Apples iPhone Enters the 5G World",0.1027
71,FRC,2020-10-09,08:50AM  ,Will Higher Fee Income Aid First Republic (FRC) Q3 Earnings?,0.0
72,FRC,2020-10-06,12:30PM  ,First Republic Bank (FRC) Reports Next Week: Wall Street Expects Earnings Growth,0.3818
73,FRC,2020-10-05,09:00AM  ,First Republic Bank Declares Dividends on Series J and K Perpetual Preferred Stock,0.0
74,FRC,2020-09-29,09:00AM  ,First Republic Bank Announces Third Quarter 2020 Earnings and Conference Call Date,0.0
75,FRC,2020-09-14,09:00AM  ,Wealth Manager Brian Addington Joins First Republic,0.4939
76,FRC,2020-09-09,08:13PM  ,Hedge Funds Have Never Been This Bullish On First Republic Bank (FRC),0.0
77,FRC,2020-09-09,07:10PM  ,First Republic Bank Announces Pricing of $500 Million Series K Preferred Stock Offering,0.0
78,FRC,2020-09-09,08:55AM  ,First Republic Announces Series K Preferred Stock Offering,0.0
79,FRC,2020-09-09,08:40AM  ,First Republic Bank Issues Notice of Redemption of Series F Preferred Shares,0.296
80,FRC,2020-09-02,09:00AM  ,First Republic Bank Declares Dividends on Four Series of Perpetual Preferred Stock for Third Quarter 2020,0.0
81,FRC,2020-08-27,06:54PM  ,Moody's takes action on 12 Prime Jumbo RMBS issued by Sequoia Mortgage Trust,0.5106
82,FRC,2020-08-27,12:33PM  ,Analysts Say These 3 Stocks Are Their Top Picks for 2020 and Beyond,0.2023
83,FRC,2020-08-18,08:33AM  ,First Republic (FRC) Poised for Growth: Should You Hold?,0.5574
84,FRC,2020-08-13,11:30AM  ,First Republic Bank (FRC) Up 7.5% Since Last Earnings Report: Can It Continue?,0.0
85,FRC,2020-08-13,09:00AM  ,Wealth Management Team Led by Phil Scott Joins First Republic,0.4939
86,FRC,2020-08-03,09:00AM  ,Six Wealth Managers Join First Republic in New York,0.6597
87,FRC,2020-07-28,06:40PM  ,First Republic Announces FRC Founders Index FundSM,0.0
88,FRC,2020-07-26,04:03PM  ,First Republic Bank Is a Bank Stock You Should Know,0.0
89,FRC,2020-07-21,01:14PM  ,Update: First Republic Bank (NYSE:FRC) Stock Gained 78% In The Last Five Years,0.3818
90,FRC,2020-07-14,10:31PM  ,First Republic Bank (FRC) Q2 2020 Earnings Call Transcript,0.0
91,FRC,2020-07-14,10:32AM  ,Price Over Earnings Overview: First Republic Bank,0.0
92,FRC,2020-07-14,09:07AM  ,First Republic (FRC) Q2 Earnings Beat on Higher Revenues,0.0
93,FRC,2020-07-14,08:25AM  ,First Republic Bank (FRC) Q2 Earnings Surpass Estimates,0.0
94,FRC,2020-07-14,07:22AM  ,First Republic Bank: Q2 Earnings Insights,0.0
95,FRC,2020-07-14,07:00AM  ,First Republic Reports Second Quarter 2020 Results,0.0
96,FRC,2020-07-13,04:49PM  ,Big banks kick off earnings season on Tuesday  heres what to expect,0.0
97,FRC,2020-07-12,08:53PM  ,Did Hedge Funds Make The Right Call On First Republic Bank (FRC) ?,0.0
98,FRC,2020-07-12,04:53PM  ,"Earnings season kicks off with big banks, Netflix: What to know in the week ahead",0.0
99,FRC,2020-07-10,09:32AM  ,"Low Rates, Provisions to Mar First Republic (FRC) Q2 Earnings",-0.2732
